_id,label,table1.id,table2.id,table1.title,table2.title,table1.manufacturer,table2.manufacturer,table1.price,table2.price
4959,1,982,2224,power on now up to date & contact windows,now software nuw45e1k now up-to-date & contact for windows,power-on-software,power-on-software,129.99,114.99
4960,0,235,1447,pdf converter professional v4 english,i copydvds 2 professional edition,nuance communications inc.,me-too-software,99.99,27.9
4961,0,510,3007,reader rabbit learning system 1st grade,reader rabbit reading learning system 2007,encore software,,29.99,12.95
4962,0,606,1007,microsoft office 2004 professional ( mac ),microsoft academic microsoft office project 2003 professional,microsoft,,499.99,176.99
4963,0,611,3092,quickbooks premier manufacturer and wholesale edition 2007,quickbooks ( r ) pro 2007,intuit,,399.95,179.99
4964,0,584,2959,microsoft windows vista business full version [ dvd ],microsoft windows vista business full version,microsoft,,299.95,249.95
4965,0,1272,2468,punch ! home design architectural series 18,punch software 14100 punch ! professional home design suite for windows,punch ! software,punch software,129.99,62.99
4966,0,578,998,microsoft office excel 2007,microsoft word 2004,microsoft,,229.95,209.99
4967,0,556,3021,instant immersion italian deluxe 2.0,instant immers spanish dlux 2,topics entertainment,,49.99,36.11
4968,0,1264,1342,punch ! professional home design suite,punch software 42100 punch ! home design architectural series 18 ( small box ),punch ! software,punch software,69.99,119.99
4969,0,520,2470,quickbooks premier nonprofit edition 2007,intuit inc 284216 qckbks prem nonprofit ed 2005,intuit,,399.95,404.0
4970,0,225,2863,microsoft powerpoint 2004 ( mac ),microsoft money 2007 premium ( pc ),microsoft,,229.99,79.99
4971,1,131,1816,microspot interiors,microspot interiors ( mac 10.2 or later ),microspot ltd.,,99.95,99.95
4972,0,858,904,microsoft onenote 2007 upgrade,microsoft office 2004 standard,microsoft,,79.95,369.99
4973,0,369,2845,tlc arthur 's kindergarten learning system 2008,dr. seuss reading learning system 2008 encore,encore,,19.99,19.95
4974,0,722,1368,steinberg nuendo 3 digital audio software,steinberg cubase studio 4 software music production software,steinberg,,2499.0,399.99
4975,0,124,2388,tlc dr. seuss reading learning system 2008,student home learning system,encore,,19.99,109.99
4976,0,620,566,adobe premiere pro cs3,adobe cs3 web standard,adobe,,799.0,1035.99
4977,0,731,2996,instant immersion italian platinum,instant immersion 33 languages,topics entertainment,topics entertainment,129.99,43.99
4978,0,604,2837,microsoft office small business 2007 full version,microsoft money 2007 home and business ( pc ),microsoft,,449.95,89.99
4979,0,320,3092,quicken 2007 premier,quickbooks ( r ) pro 2007,intuit,,79.95,179.99
4980,1,1093,2755,final cut express 2.0 upgrade,apple software m9372z/a final cut express 2.0 upgrade,apple computer,apple software,99.99,79.99
4981,0,699,1192,scrapbook for windows,act ! 2004 for windows,abacus,,,249.95
4982,0,1024,2432,punch super home suite 3.0,punch software punch ! super home suite,punch ! software,,49.99,49.95
4983,0,1145,1075,microsoft office 2004 standard ( mac ),microsoft ( r ) excel 2007,microsoft,,399.99,109.99
4984,0,1132,1015,civilization iv dvd-rom ( mac ),aspyr media sid meiers civilization iv mac,aspyr media,,49.99,44.99
4985,0,1018,2079,wheel of fortune deluxe,encore software 14131 wheel of fortune deluxe,encore,,19.99,17.97
4986,0,320,1136,quicken 2007 premier,quicken ( r ) for mac 2007,intuit,,79.95,69.99
4987,0,48,2855,national geographic presents : forces of nature,national geographic photo gallery topics,topics entertainment,,29.99,9.95
4988,0,1257,2468,total 3d home & landscape design suite version 9,punch software 14100 punch ! professional home design suite for windows,individual software,punch software,39.99,62.99
4989,0,774,3003,adobe software acrobat pro upgrd pro-pro mac ( adbcd01798mc ),adobe acrobat professional 7,adobe software,,273.0,350.0
4990,0,875,2671,century software tinyterm plus v. 4.0 complete product,sony creative software vegas43 ; dvd production suite v. 7.0 complete product,century software,,,262.82
4991,0,750,2617,microspot interiors ( mac ),star wars empire at war ( mac intel ),microspot ltd.,,99.95,49.99
4992,0,565,430,adobe creative suite cs3 web premium [ mac ],adobe cs3 web standard upgrade,adobe,,1599.0,413.99
4993,0,402,1519,blues clues preschool,brain play preschool 1st grade,humongous entertainment,,,25.99
4994,0,492,2174,microsoft productivity pack for windows mobile,resco explorer 2007 for pocketpc windows mobile software for pocket pc,microsoft,,29.99,29.95
4995,0,1176,328,valuesoft tune transfer for ipod software for windows xp,powerhouse migo for ipod for windows,valuesoft,,29.95,71.99
4996,0,559,151,adobe dreamweaver cs3 [ mac ],adobe indesign cs3 for mac upgrade,adobe,,399.0,205.99
4997,0,711,3102,family tree maker 2008 platinum,family tree maker version 16 deluxe ( 10870 ),encore,,99.95,57.59
4998,0,115,889,encyclopedia britannica deluxe 2008 win/mac,avanquest usa llc britannica deluxe,avanquest,,29.95,26.11
4999,1,1212,548,math success deluxe 2008,topics entertainment math success deluxe 2008,topics entertainment,,49.99,31.06
5000,0,616,2853,microsoft windows vista home basic upgrade [ dvd ],microsoft windows xp professional edition ( upgrade ),microsoft,,99.95,199.99
5001,0,1290,1083,punch ! home design architectural series 4000 v10,punch software 14100 punch ! professional home design suite for windows,punch ! software,punch software,199.99,62.99
5002,0,858,915,microsoft onenote 2007 upgrade,microsoft office 2004 std upgrade,microsoft,,79.95,219.99
5003,0,522,2816,microsoft visio standard 2007,microsoft word 2007 upgrade ( pc ),microsoft,,259.95,109.95
5004,1,967,2131,mavis beacon teaches typing 16,mavis beacon 16,broderbund,,19.99,17.9
5005,0,412,71,adobe creative suite cs3 web premium upsell [ mac ],29270055 adobe creative suite 3 web standard complete package 1 user cd win uni,adobe,,1399.0,1056.98
5006,1,581,2583,hoyle board games,encore software 10027 hoyle board games ( win 98 me 2000 xp ),encore,,9.99,7.47
5007,0,1114,2739,webroot spy sweeper antispyware 5.x,webroot software 54210 desktop firewall,webroot software,webroot software,29.95,26.99
5008,0,3,1317,peachtree by sage premium accounting for nonprofits 2007,peachtree ( r ) compatible continuous checks-accounting for windows 8.0-2004 version,sage software,,599.99,91.59
5009,0,654,1188,acrobat professional 8 ( windows ),system care ? professional,adobe,,273.0,49.99
5010,0,248,2513,microsoft windows small business server cal 2003 license pack 20 client addpack device,microsoft r18-00908 windows server 2003 client access license 20-pack ( per user ),microsoft software,microsoft,,688.99
5011,0,604,1159,microsoft office small business 2007 full version,microsoft ( r ) office 2004 for mac standard edition upgrade version,microsoft,,449.95,234.95
5012,0,602,99,adobe creative suite cs3 design standard upgrade [ mac ],19500220 adobe creative suite 3 design premium product upgrade package 1 user upgra,adobe,,399.0,1687.48
5013,0,752,993,age of empires iii,age of empires iii : warchiefs expansion pack,destineer,,49.99,34.95
5014,0,1284,1433,punch ! master landscape & home design,punch software 20100 punch ! 5 in 1 home design,punch ! software,punch software,99.99,35.99
5015,1,1007,815,wisdom of the bible holy land edition,tri synergy inc wisdom of the bible holy land edition,hip interactive,,29.99,16.01
5016,0,544,1899,microsoft windows xp home edition full version with sp2,p72-00473 microsoft windows server enterprise edition license & software assurance 1 u,microsoft,,199.0,3282.33
5017,0,1293,203,systemsuite 8 professional,avanquest usa llc system care professional,individual software,,49.99,43.32
5018,0,892,893,adobe premiere pro cs3,adobe cs3 design premium upgrade,adobe,,799.0,619.99
5019,0,1074,279,family tree maker version 16 collectors edition sb cs,encore inc family tree maker v 16 essentials,encore software,,99.99,25.75
5020,0,781,1159,microsoft excel 2004 ( mac ),microsoft ( r ) office 2004 for mac standard edition upgrade version,microsoft,,229.99,234.95
5021,0,1264,1033,punch ! professional home design suite,punch software 84100 punch ! home design architectural series 4000 v. 10.0 architectural pc,punch ! software,,69.99,168.97
5022,0,1042,2478,genuine fractals print pro 4.1 sharpener pro 2.0,onone software inc. gpp-55212 upg genuine fractals print pro 5 1u,onone software,,,66.97
5023,0,322,372,adobe premiere pro 2.0,adobe premiere pro cs3 upgrade,adobe,,849.0,308.99
5024,0,1284,2402,punch ! master landscape & home design,punch software 41100 punch ! home design architectural series 18,punch ! software,punch software,99.99,118.99
5025,1,59,2119,studyworks ! teaching pro : middle school math & science ( win/mac ),middle school math & science,global-software-publishing,global-software-publishing,29.99,12.9
5026,0,137,42,netmanage rumba unix-hp edition v. 7.3 upgrade license 902453-006 ),910519-004 rumba as/400 edition v. 7.4 upgrade license 1 processor tier p10 c,netmanage,,,3223.26
5027,0,930,355,adobe contribute cs3 [ mac ],adobe cs3 after effects,adobe,,149.0,1025.99
5028,0,839,558,adobe photoshop cs3 extended,adobe cs3 design standard,adobe,,999.0,1243.99
5029,0,991,836,instant immersion spanish audio deluxe,topics entertainment instant immersion ingles audio deluxe,topics entertainment,,39.95,17.55
5030,0,1257,2587,total 3d home & landscape design suite version 9,3d home architect landscape v. 8by encore software,individual software,,39.99,26.36
5031,0,981,3022,instant immersion italian v2 .0 ( large box ),instant immersion 33 languages,topics entertainment,,29.99,47.36
5032,0,950,183,apple logic pro 7.2 upgrade,onone software qx-tools pro 7 upgrade,apple,,299.0,69.17
5033,0,602,954,adobe creative suite cs3 design standard upgrade [ mac ],adobe dreamweaver cs3 upgrade,adobe,,399.0,205.99
5034,1,833,2630,punch ! viacad 2d/3d,viacad 2d/3d ( win 2000 xp vista ),punch ! software,,99.0,99.95
5035,0,654,3164,acrobat professional 8 ( windows ),adobe flash cs3 professional complete package 1 user academic cd windows,adobe,,273.0,229.0
5036,0,443,2853,microsoft windows small business server premium 2003 r2 upgrade cd/dvd 5 client,microsoft windows xp professional edition ( upgrade ),microsoft,,709.0,199.99
5037,0,781,3091,microsoft excel 2004 ( mac ),microsoft ( r ) word 2007,microsoft,,229.99,109.99
5038,0,837,986,adobe photoshop cs3 extended upgrade [ mac ],adobe photoshop cs3 for mac,adobe,,349.0,609.99
5039,0,1258,107,punch ! home design architectura series 18,24100 punch ! 5 in 1 home design complete package 1 user cd win,punch ! software,,129.99,36.28
5040,0,1182,554,onone software pxl smartscale windows and macintosh ),onone software plug-in suite full,onone software,,,393.68
5041,0,502,108,symc backup exec sbs prm 11d win small business server,11105947 symantec backup exec 11d for windows small business server standard w / continu,symantec,,885.83,479.12
5042,0,105,2143,instant immersion spanish ( audio book ),instant immersion translator deluxe 2.0,topics entertainment,,,22.9
5043,0,737,2860,adobe photoshop cs2 ( mac ) [ old version ],adobe illustrator cs3 ( mac ),adobe,,649.0,599.0
5044,1,838,2714,computrace lojack for laptops 3 year license ( mac ),absolute software lfl-m2-36 computrace lojack for laptops 3 year license mac 10.2 or higher,absolute software,,99.95,80.97
5045,0,641,252,sims 2 nightlife expansion pack,aspyr sims 2 university expansion pack,aspyr media,,34.99,35.99
5046,0,736,99,adobe creative suite cs3 production premium upgrade,19500220 adobe creative suite 3 design premium product upgrade package 1 user upgra,adobe,,799.0,1687.48
5047,0,382,426,adobe production studio premium,adobe cs3 production premium upgrade,adobe,,1699.0,822.99
5048,0,753,332,microsoft office & windows training professional,microsoft virtual pc 7.0 windows xp home,topics entertainment,,49.95,205.99
5049,0,614,496,microsoft works suite 2006,csdc namo webeditor suite 2006,microsoft,,99.0,83.92
5050,0,838,1517,computrace lojack for laptops 3 year license ( mac ),computrace lojack for laptops 1 year license ( win 2000 xp ),absolute software,,99.95,49.95
5051,0,139,521,adobe creative suite cs3 design premium upsell [ mac ],adobe cs3 design premium,adobe,,1599.0,1865.99
5052,0,1262,921,adobe flash pro cs3 upgrade [ mac ],adobe cs3 production premium,adobe,,199.0,1749.99
5053,0,528,3034,quickbooks simple start 2007,quickbooks pro 2007 win,intuit,,99.95,192.26
5054,0,879,1448,sony sound forge 9 boxed upgrade,sony creative software sfas9000 sound forge audio studio 9,sony media,,232.05,53.97
5055,1,735,2931,adventure workshop preschool ( jewel case ),encore software 10538 adventure workshop preschool 7 by the learning company,encore software,,29.99,17.97
5056,0,1235,145,photoshop elements 4 edu mac 1u,adobe photoshop elements 4.0 mac,adobe-education-box,,69.0,79.99
5057,0,1285,2656,black & white platinum pack ( mac ),intervideo windvd 8 platinum ( pc ),feral interactive,,29.99,59.99
5058,1,26,3032,adobe premiere pro cs3 upgrade,premiere pro cs3 mac upgrade,adobe,,299.0,320.25
5059,1,1192,574,mcafee virusscan plus 3 user,mcafee inc mcafee virusscan plus sub 1:1 3u mb en,mcafee,,59.99,56.38
5060,0,1198,1070,quickbooks point-of-sale basic 6.0,quickbooks ( r ) point of sale 2007 : basic retail management 6.0 bundle,intuit,,799.95,1499.99
5061,1,30,428,adobe fireworks cs3 [ mac ],adobe fireworks cs3,adobe,,299.0,309.99
5062,0,1330,2440,onone essentials for adobe photoshop elements version 2 full,onone software ele-10211 on1 essentials v. 1.0 for photoshop elements complete product graphics/designing 1 user complete product standard english pc mac,onone software,,59.95,50.97
5063,0,354,3108,the universe ( win/mac ) ( jewel case ),total 3d home deluxe ( jewel case ) ( jce-th6 ),fogware publishing,,9.99,9.59
5064,0,917,2987,elementary advantage 2008,elementary school success deluxe 2006,encore software,,,12.95
5065,0,465,3043,adobe creative suite cs3 web standard upgrade [ mac ],state standards grade 8,adobe,,399.0,9.49
5066,0,653,2587,3d home architect home design deluxe version 9,3d home architect landscape v. 8by encore software,encore,,29.99,26.36
5067,0,945,3099,classification & ecology ( win/mac ) ( jewel case ),merriam-webster 's dictionary ( win/mac ) ( jewel case ) ( 10462 ),fogware publishing,,9.99,9.59
5068,0,1242,1061,peachtree by sage premium accounting 2007,sage software peachtree complete accounting 2007 software for windows tax & finance software,sage software,,499.99,249.95
5069,1,635,279,family tree maker version 16 essentials,encore inc family tree maker v 16 essentials,encore,,29.95,25.75
5070,0,749,582,retrospect 6.0 desktop mac,emc insignia retrospect server 6.0 for mac upgrade,dantz,,99.99,285.99
5071,1,969,837,talk now ! learn afrikaans beginning level,topics entertainment talk now ! afrikaans beginners,eurotalk,,29.99,16.93
5072,0,829,1117,avid liquid vs 7 software,software,avid technology,,888.75,736.95
5073,0,443,1828,microsoft windows small business server premium 2003 r2 upgrade cd/dvd 5 client,u84-00101 microsoft windows server 2003 for small business license 5 device cals ope,microsoft,,709.0,303.9
5074,0,1148,3003,sibelius 4 professional edition,adobe acrobat professional 7,sibelius-software-ltd .,,599.99,350.0
5075,0,946,2093,the print shop 21 deluxe by broderbund,encore software 10691 the print shop 22 sb cs by the print shop,encore software,,,25.97
5076,0,382,1059,adobe production studio premium,sony media software acid music studio 7 software music production software,adobe,,1699.0,69.95
5077,0,772,331,adobe illustrator cs3 [ mac ],adobe indesign cs3 for mac,adobe,,599.0,725.99
5078,1,444,2159,jumpstart 1st grade,jumpstart 1st grade ( jc ),knowledge adventure,,,9.9
5079,0,370,1121,cosmi talking math & more for kids ( windows ),learning quickbooks ( r ) for windows ( r ),cosmi,,,39.99
5080,0,753,1007,microsoft office & windows training professional,microsoft academic microsoft office project 2003 professional,topics entertainment,,49.95,176.99
5081,0,945,3119,classification & ecology ( win/mac ) ( jewel case ),poetry fiction and drama ( win/mac ) ( jewel case ) ( 10172 ),fogware publishing,,9.99,9.59
5082,0,522,2818,microsoft visio standard 2007,microsoft windows vista business ( pc ),microsoft,,259.95,299.99
5083,0,1195,2402,home design architect series 3000 v10 .0,punch software 41100 punch ! home design architectural series 18,punch ! software,punch software,149.95,118.99
5084,0,594,2620,corel wordperfect office x3 professional edition,sony vegas 6 video editing software professional editing software,corel,sony-pictures-digital-entertainment,399.99,99.0
5085,0,146,3194,microsoft mappoint 2006 standard edition,microsoft ( r ) project standard 2007,microsoft,,299.0,349.95
5086,0,823,3171,microsoft word 2004 upgrade ( mac ),microsoft ( r ) project standard 2007,microsoft,,109.99,599.95
5087,0,6,2154,adobe after effects professional 6.5 upgrade from standard to professional,adobe after effects professional 7 software for windows effects software,adobe,,499.99,999.0
5088,0,608,485,adobe creative suite cs3 web premium upgrade [ mac ],adobe illustrator cs3 upgrade from freehand for mac,adobe,,499.0,206.99
5089,0,1190,352,punch ! professional home design,adobe cs3 flash professional,punch ! software,,89.99,724.99
5090,0,642,986,adobe flash pro cs3 [ mac ],adobe photoshop cs3 for mac,adobe,,699.0,609.99
5091,1,1264,2752,punch ! professional home design suite,punch software 35100 punch ! professional home design suite ( small box ),punch ! software,punch software,69.99,62.99
5092,0,1321,2062,instant immersion american sign language win/mac,instant immersion language lab deluxe edition,topics entertainment,,9.99,14.9
5093,0,592,371,adobe after effects cs3 upgrade,adobe photoshop cs3 for mac upgrade,adobe,,299.0,189.99
5094,0,686,319,lego star wars ( dvd ) ( mac ),aspyr star wars battlefront mac os x,aspyr media,,29.99,45.99
5095,1,1028,2333,makemusic finale 2007 win/mac,make finale 2007 software music production software,emedia,,600.0,429.95
5096,0,1127,1088,steinberg sequel ( pc or mac ) music creation & performance software,sony media software super duper music looper software music production software,steinberg,sony-media-software,129.0,19.95
5097,0,145,286,microsoft virtual pc for mac 7.0 with windows 2000,microsoft windows xp home edition sp2 retail box,microsoft,,249.99,199.99
5098,1,772,465,adobe illustrator cs3 [ mac ],adobe illustrator cs3 for mac,adobe,,599.0,619.99
5099,0,1177,915,microsoft office student and teacher edition 2004 macintosh,microsoft office 2004 std upgrade,microsoft,,149.99,219.99
5100,0,781,3194,microsoft excel 2004 ( mac ),microsoft ( r ) project standard 2007,microsoft,,229.99,349.95
5101,0,531,1828,microsoft windows server 2003 client additional license for users-5 pack,u84-00101 microsoft windows server 2003 for small business license 5 device cals ope,microsoft,,809.0,303.9
5102,0,474,3190,microsoft asp net web matrix,microsoft ( r ) mappoint ( r ) 2006,microsoft,,30.0,249.99
5103,0,654,2688,acrobat professional 8 ( windows ),sony vegas7 .0 + dvd editing software with sound forge 8 for windows professional editing software,adobe,,273.0,549.95
5104,0,802,2247,final draft 7/syd field 's screenwriting workshop dvd bundle,final-draft final draft 7 screen writing software mac/win screen writing software,final draft,,249.99,249.95
5105,0,248,2818,microsoft windows small business server cal 2003 license pack 20 client addpack device,microsoft windows vista business ( pc ),microsoft software,,,299.99
5106,0,532,1108,quickbooks pro 2007 for mac ( mac ),quickbooks ( r ) point of sale 2007 : basic retail management 6.0,intuit,,199.95,799.99
5107,0,620,580,adobe premiere pro cs3,adobe dreamweaver cs3 academic,adobe,adobe-education-box,799.0,195.99
5108,0,267,508,adobe photoshop elements 5.0 / premier elements 3.0 [ lb ],adobe photoshop elements 4.0 mac academic,adobe,adobe-education-box,149.99,69.99
5109,0,866,2998,system care professional,orgchart professional 1.3,avanquest,,49.95,39.95
5110,0,791,1118,hoyle kids ' games jc,hoyle ( r ) card games 2007,encore,,9.99,19.99
5111,1,956,2291,apple logic pro 7.2 retail,apple/emagic logic pro 7.2 software music production software,apple,,999.0,999.0
5112,0,1055,2345,high school advantage 2007,encore software 12371 encore middle school advantage 2008 training/wbt pc,encore software,,29.95,33.97
5113,0,1284,107,punch ! master landscape & home design,24100 punch ! 5 in 1 home design complete package 1 user cd win,punch ! software,,99.99,36.28
5114,0,895,1593,hoyle card games 2007,encore 10025 hoyle card games for pc,encore software,encore,19.99,10.0
5115,0,751,3151,project x project management software,graphics software,marware,,199.95,99.92
5116,0,944,3167,registry mechanic by encore software,software,encore software,,46.52,46.99
5117,0,550,2818,windows vista business spanish full version [ dvd ],microsoft windows vista business ( pc ),microsoft,,329.95,299.99
5118,1,177,1481,world of warcraft 60 day pre-paid time card,vivendi-universal games inc 72305 world of warcraft 60 day prepaid,blizzard entertainment,,29.99,27.99
5119,0,551,134,symc backup exec sbs aws 11d win sbs agent for windows systems,10759458 symantec backup exec 11d for windows small business server premium w / continuo,symantec,,447.74,520.31
5120,0,1287,2920,punch ! 5 in 1 home design,punch software professional home design platinum version 10,punch ! software,,39.99,99.99
5121,0,515,1153,instant immersion spanish deluxe 2.0,photo explosion deluxe ( r ) 2.0,topics entertainment,,49.99,49.99
5122,0,299,2964,wacky farm,wacky farm,casual arcade,,19.95,8.95
5123,0,268,3114,world of rainbow fish,world of wild cats,global-software-publishing,,19.99,8.95
5124,0,233,2840,photo explosion deluxe 3.0,photo explosion deluxe 3.0 nova,nova development,,49.99,49.99
5125,1,769,384,power director 3,cyberlink power director 3,avanquest-publishing-usa-inc .,avanquest-publishing-usa-inc .,79.95,9.99
5126,0,604,2206,microsoft office small business 2007 full version,microsoft office 2004 software suite oem mac apple & mac software,microsoft,,449.95,239.95
5127,0,597,452,adobe creative suite cs3 design premium [ mac ],adobe cs3 production premium upsell,adobe,,1799.0,1234.99
5128,0,1241,3025,quicken legal business pro 2007,individual software business planmaker pro 2008 ( pc ),nolo press,,79.99,39.99
5129,0,571,3171,microsoft visio standard 2007 version upgrade,microsoft ( r ) project standard 2007,microsoft,,129.95,599.95
5130,0,1264,1052,punch ! professional home design suite,punch software 25100 punch ! master landscape & home design architectural 1 user ( s ) pc,punch ! software,,69.99,45.97
5131,0,662,1706,microsoft windows terminal server 2003 client additional license for users - 5 user,12031 novanet media/client server v. 10 license 3 additional servers linux,microsoft,,669.0,484.94
5132,0,827,2889,m-audio pro tools m-powered 7.3 m-audio compatible world-class production software,steinberg studio case 2 music production system educational discount music production software,m-audio,,299.99,164.95
5133,0,208,60,wasp bar code wasp bar code labeler complete package 3 users std cd -,04l1671 ibm websphere mq link for r/3 v. 1.2 complete package 1 server cd -,wasp technologies,,,12567.39
5134,0,1004,1378,professor teaches excel & word,individual software pmm-xw4 professor teaches excel & word 2007 win 2000 xp vista,individual software,,19.99,17.97
5135,1,819,2830,mavis beacon 17 standard,mavis beacon teaches typing 17 standard ( pc/mac ) encore,encore software,,19.95,19.99
5136,0,309,251,family tree maker version 16 deluxe,encore inc family tree maker version 16 collectors edition,encore,,69.95,85.07
5137,0,531,1137,microsoft windows server 2003 client additional license for users-5 pack,microsoft windows vista business upgrade license 1 pc english,microsoft,,809.0,168.99
5138,0,418,1584,essential business tools 2.0,emedia essential bass guitar dvd,valusoft,,19.99,16.95
5139,0,21,169,world book encyclopedia 2006,tri synergy inc oxford world encyclopedia,topics entertainment,,19.99,16.31
5140,0,910,1678,adobe creative suite cs3 master collection upgrade [ mac ],adobe creative suite ( v3 .0 ) design premium mac adobe 19500009,adobe,,1399.0,1482.0
5141,0,54,415,allume boost xp for windows,abacus scrapbook for windows,smith-micro-software,,29.99,26.14
5142,0,1329,1475,instant immersion translator deluxe 2.0,instant immersion japanese ( audio book ) ( audio book ),topics entertainment,,49.99,19.95
5143,0,183,2105,jumpstart reading with karaoke,jumpstart phonics ( jc ),knowledge adventure,,29.99,9.9
5144,0,640,3201,alsoft diskwarrior : mac univeral binary,alsoft disk warrior v/5 cd,alsoft,,,107.95
5145,0,251,1828,microsoft crm small business ed cal 3.0 license pack user cal,u84-00101 microsoft windows server 2003 for small business license 5 device cals ope,microsoft software,,9929.0,303.9
5146,1,875,2475,century software tinyterm plus v. 4.0 complete product,century software ttpl-1 century tinyterm plus v. 4.0 complete product connectivity/data acess 1 user ( s ) complete product standard english pc,century software,,,188.97
5147,0,481,1168,art explosion t-shirt factory deluxe 3.0,art explosion ( r ) 800000,nova development,,29.99,79.99
5148,0,1253,1501,reel deal casino shuffle master edition,reel deal casino quest ( win 95 98 me 2000 xp ),phantom efx,,19.99,19.95
5149,0,823,2818,microsoft word 2004 upgrade ( mac ),microsoft windows vista business ( pc ),microsoft,,109.99,299.99
5150,0,584,1514,microsoft windows vista business full version [ dvd ],microsoft windows vista home basic upgrade ( pc ),microsoft,,299.95,99.99
5151,0,557,1166,adobe creative suite cs3 production premium,sony vegas 7 + dvd production suite software full version video editing and dvd creation,adobe,,1699.0,426.0
