_id,label,table1.id,table2.id,table1.title,table2.title,table1.manufacturer,table2.manufacturer,table1.price,table2.price
3436,0,496,2419,microsoft windows vista business 32-bit for system builders,windows vista business sp microsoft 66j-00063,microsoft,,179.99,272.38
3437,0,544,1514,microsoft windows xp home edition full version with sp2,microsoft windows vista home basic upgrade ( pc ),microsoft,,199.0,99.99
3438,0,105,845,instant immersion spanish ( audio book ),topics entertainment instant immersion italian 2.0,topics entertainment,,,17.55
3439,0,1262,372,adobe flash pro cs3 upgrade [ mac ],adobe premiere pro cs3 upgrade,adobe,,199.0,308.99
3440,0,90,1908,emc retrospect 7.5 professional for windows upgrade,nuance dragon naturallyspeaking v. 9.0 professional upgrade,dantz,,,212.62
3441,0,858,1512,microsoft onenote 2007 upgrade,microsoft w87-02380 office sbe 2007 win32,microsoft,,79.95,400.34
3442,0,1185,741,3d home architect landscape design deluxe version 9,3d home architect home v. 8by encore software,encore,,29.99,33.92
3443,0,516,1865,adobe creative suite cs3 design premium upgrade [ mac ],19700045 adobe creative suite 3 web premium complete package 1 user cd mac univ,adobe,,599.0,1691.87
3444,0,115,3000,encyclopedia britannica deluxe 2008 win/mac,encyclopedia britannica 2007 ready reference,avanquest,,29.95,8.95
3445,0,321,1600,route 66 mobile 7 usa/cdn for windows mobile 5,zoo tycoon for windows,csdc,,149.0,25.99
3446,0,1073,1333,backyard sports backyard basketball and backyard football,backyard sports : baseball 2007 for pc,humongous entertainment,,19.99,19.99
3447,0,143,1516,adobe acrobat distiller svr v6-cd linux u/u 42050142 ),adobe 42050106 acrobat distiller svr v6-cd sun 100u,adobe systems,adobe,,5399.99
3448,0,599,3014,instant immersion french deluxe 2.0,instant immers german dlux 2.0,topics entertainment,,49.99,36.11
3449,0,615,430,adobe creative suite cs3 design standard upgrade,adobe cs3 web standard upgrade,adobe,,399.0,413.99
3450,0,773,1686,microsoft office mac 2004 english 3pk dsp 731-01163 ),word mac 2004 microsoft d48-00487,microsoft corporation,,,157.18
3451,0,923,485,adobe illustrator cs3 upgrade [ mac ],adobe illustrator cs3 upgrade from freehand for mac,adobe,,199.0,206.99
3452,0,1290,1028,punch ! home design architectural series 4000 v10,punch software 83100 punch ! home design architectural series 3000 v 10 ( win 98 me nt 2000 xp ),punch ! software,,199.99,124.97
3453,0,271,73,microsoft office small business 2007,cabprenaen150 ca business protection suite for microsoft small business server premium edition,microsoft software,,735.33,666.65
3454,0,1186,1150,adobe creative suite cs3 web standard [ mac ],adobe acrobat 7.0 standard academic mac,adobe,,999.0,98.99
3455,0,523,959,microsoft windows vista ultimate full version [ dvd ],microsoft windows vista business retail no open box returns,microsoft,,399.95,299.99
3456,0,616,2818,microsoft windows vista home basic upgrade [ dvd ],microsoft windows vista business ( pc ),microsoft,,99.95,299.99
3457,0,1076,2050,the print shop 22 sb cs by the print shop,the printshop v22 deluxe,encore software,,,29.9
3458,0,271,2206,microsoft office small business 2007,microsoft office 2004 software suite oem mac apple & mac software,microsoft software,,735.33,239.95
3459,0,611,2530,quickbooks premier manufacturer and wholesale edition 2007,intuit quickbooks premier professional services edition 2007 software win tax & finance software,intuit,,399.95,349.95
3460,0,1072,2546,marine aquarium & goldfish screen saver by encore software,encore software 10272 marine aquarium + sharks win 98 me 2000 xp,encore software,,,7.69
3461,0,779,462,3d home architect landscape v. 8 by encore software,individual software inc total 3d home & landscape deluxe 9,encore software,,39.99,33.5
3462,1,1361,963,mediarecover,allume mediarecover,aladdin systems,,29.99,32.99
3463,0,536,2649,adobe photoshop elements 4.0 ( mac ),adobe photoshop cs3 ( mac os x v. 10.4.8 ),adobe,,89.99,649.0
3464,0,839,508,adobe photoshop cs3 extended,adobe photoshop elements 4.0 mac academic,adobe,adobe-education-box,999.0,69.99
3465,0,863,2250,cubase se3 educational edition,steinberg cubase studio 4 software educational discount music production software,steinberg,,,179.95
3466,1,494,1370,webobjects 5.2,apple web objects 5.2 software apple & mac software,apple,,699.95,689.95
3467,1,808,535,3d home architect landscape designer v8,encore inc 3d home architect landscape designer v 8.0,encore software,,29.99,25.49
3468,0,705,2752,professional home design suite platinum,punch software 35100 punch ! professional home design suite ( small box ),punch ! software,punch software,99.95,62.99
3469,0,992,2327,final draft 7 professional scriptwriting win/mac,final-draft scriptwriter 's suite 2.5 screenwriting software mac/win screen writing software,final draft,,289.99,279.95
3470,0,1186,368,adobe creative suite cs3 web standard [ mac ],adobe cs3 design standard upgrade windows,adobe,,999.0,413.99
3471,0,602,939,adobe creative suite cs3 design standard upgrade [ mac ],adobe cs3 design premium academic,adobe,,399.0,575.99
3472,0,514,273,microsoft windows vista ultimate upgrade [ dvd ],microsoft windows xp pro sp2 retail,microsoft,,259.95,299.99
3473,1,867,2484,punch ! ultimate deck and landscape,punch software 13100 punch ! ultimate deck & landscape complete product creativity application 1 user ( s ) complete product standard pc,punch ! software,,29.0,29.97
3474,0,79,2430,ca internet security suite 2007 3 user,ca iss2007lec10 ca internet sec ste 2007 w/warranty xl box ecommerce 10u 0757943317589,computer associates,,69.95,153.86
3475,1,1006,796,terror strike,encore software 14060 terror strike win 2000 xp,encore,,19.95,18.97
3476,0,135,3109,microsoft crm professional cal 3.0 product upgrade license pack user cal,microsoft windows server 2003 client additional license for devices 5 pack ( 823930 ),microsoft software,,9980.0,158.39
3477,0,967,2055,mavis beacon teaches typing 16,encore software 10076 mavis beacon typing 17 standardby broderbund,broderbund,,19.99,17.97
3478,0,1287,2447,punch ! 5 in 1 home design,punch software 86100 prof home design platinum v10 sb win 98 me nt 2000 xp,punch ! software,,39.99,84.97
3479,0,514,1169,microsoft windows vista ultimate upgrade [ dvd ],microsoft ( r ) windows vista ( tm ) home premium,microsoft,,259.95,239.99
3480,0,520,3055,quickbooks premier nonprofit edition 2007,quicken 2007 premier win cd,intuit,intuit,399.95,73.99
3481,0,604,1014,microsoft office small business 2007 full version,microsoft office basic edition 2003 license and media,microsoft,,449.95,124.95
3482,0,1282,68,adobe after effects cs3,15510669dm adobe after effects cs3 professional v. 8 media tlp tlp nonprofit d,adobe,,999.0,18.88
3483,0,1022,2489,panda internet security 2007 3-user,symantec 10725608 norton internet security 2007 internet security 1 user ( s ) pc,panda software,,69.95,64.97
3484,0,382,2496,adobe production studio premium,cakewalk sonar home studio 6 software music production software,adobe,,1699.0,99.0
3485,0,365,3108,english literature basics ( win/mac ) ( jewel case ),total 3d home deluxe ( jewel case ) ( jce-th6 ),fogware publishing,,9.99,9.59
3486,0,1299,3110,snap ! spelling ( jewel case ),cross stitch design studio ( jewel case ) ( 8006 ),topics entertainment,m-and-r-technologies,19.95,9.59
3487,0,646,1475,instant immersion german audio,instant immersion japanese ( audio book ) ( audio book ),topics entertainment,,,19.95
3488,0,513,2547,mavis beacon typing 17 ( win/mac ),encore software 10072 mavis beacon typing 17 deluxe by broderbund,encore software,,19.99,33.97
3489,0,270,1497,adobe acrobat 7.0 professional,microsoft office and windows training professional,adobe,,449.99,29.99
3490,0,19,871,school zone pencil-pal software big phonics ( cd-rom & book ),school zone interactive math 2 on track software,school-zone-interactive,,,9.45
3491,0,443,2441,microsoft windows small business server premium 2003 r2 upgrade cd/dvd 5 client,microsoft windows vista ultimate upgrade,microsoft,,709.0,239.95
3492,0,1001,2565,printmaster 17 platinum by encore software,marine aquarium & goldfishscreen saver by encore software,encore software,,39.99,18.27
3493,0,654,700,acrobat professional 8 ( windows ),individual software inc systemsuite 8 professional ( us pos ),adobe,,273.0,46.42
3494,0,236,2827,readiris pro 11,readiris pro 11 corporate edition for pc,global marketing partners,,129.99,349.99
3495,0,750,3107,microspot interiors ( mac ),microspot interiors ( ints3 .6 sb ),microspot ltd.,,99.95,95.95
3496,1,746,2632,marketcircle daylite v3 .0 ( mac ),daylite v3 .0 marketcircle ( mac 10.4 or later ),csdc,,149.0,149.0
3497,0,1195,313,home design architect series 3000 v10 .0,encore inc 3d home architect home design deluxe version 9,punch ! software,,149.95,25.49
3498,0,1353,2062,instant immersion italian deluxe v2 .0 ( large box ),instant immersion language lab deluxe edition,topics entertainment,,29.99,14.9
3499,0,944,240,registry mechanic by encore software,encore inc registry mechanic 6.0,encore software,,46.52,25.49
3500,0,548,2386,quickbooks pro 2007 small business financial software,intuit quicken basic 2007 software for windows tax & finance software,intuit,,199.95,29.95
3501,0,805,1087,hoyle texas hold 'em poker ( jewel case ),tournament poker no limit texas holdem,encore,,9.99,19.99
3502,0,264,1151,adobe photoshop cs3 extended [ mac ],adobe photoshop cs3 extended complete package 1 user academic cd windows,adobe,,999.0,279.0
3503,0,119,1586,sierra hallmark card studio special edition windows ),hallmark card studio 2006,nova development,,,29.36
3504,0,1353,3022,instant immersion italian deluxe v2 .0 ( large box ),instant immersion 33 languages,topics entertainment,,29.99,47.36
3505,0,1331,1668,funny faces deluxe,myinvoices & estimates deluxe,fogware publishing,,19.99,39.99
3506,0,1258,3026,punch ! home design architectura series 18,punch software 90500 home design studio mac,punch ! software,punch software,129.99,135.99
3507,0,271,3187,microsoft office small business 2007,microsoft office onenote 2007 complete package 1 pc cd win english,microsoft software,,735.33,78.99
3508,0,361,1865,adobe creative suite cs3 web standard upsell,19700045 adobe creative suite 3 web premium complete package 1 user cd mac univ,adobe,,799.0,1691.87
3509,0,216,954,adobe illustrator cs3 upgrade from freehand [ mac ],adobe dreamweaver cs3 upgrade,adobe,,199.0,205.99
3510,0,892,182,adobe premiere pro cs3,adobe cs3 web premium upsell,adobe,,799.0,1434.99
3511,0,208,3188,wasp bar code wasp bar code labeler complete package 3 users std cd -,adobe creative suite 3 web standard complete package academic cd mac,wasp technologies,,,369.0
3512,0,45,2072,elementary school success deluxe 2006,topics entertainment reference success deluxe 2006,topics entertainment,,49.99,22.9
3513,0,408,2900,before you know it deluxe spanish edition for pc/mac,spanish before you know it deluxe,encore software,,29.99,10.95
3514,0,270,2839,adobe acrobat 7.0 professional,adobe flash cs3 professional ( mac ),adobe,,449.99,699.0
3515,0,208,78,wasp bar code wasp bar code labeler complete package 3 users std cd -,fpxmlc020-a01 vortexml v. 2 complete package 1 user cd win,wasp technologies,,,363.63
3516,0,944,801,registry mechanic by encore software,onone software smartscale software,encore software,,46.52,189.99
3517,0,602,485,adobe creative suite cs3 design standard upgrade [ mac ],adobe illustrator cs3 upgrade from freehand for mac,adobe,,399.0,206.99
3518,0,890,3014,instant immersion japanese deluxe 2.0,instant immers german dlux 2.0,topics entertainment,,39.99,36.11
3519,0,889,1103,scrabble champion edition,chatchecker family edition,encore,,19.95,29.99
3520,0,522,2441,microsoft visio standard 2007,microsoft windows vista ultimate upgrade,microsoft,,259.95,239.95
3521,0,554,1666,instant immersion german deluxe 2.0,instant immersion italian audio ( audio book ),topics entertainment,,39.99,19.95
3522,0,15,192,omnioutliner professional 3.0,adobe cs3 flash professional upgrade,csdc,,69.95,205.99
3523,1,1226,503,calculation skills v1 add & sub basic core learning,sos aggregation company calculation skills v1 add & sub basic core learning,sos-aggregation-company,sos-aggregation-company,,15.91
3524,0,1264,1026,punch ! professional home design suite,punch software 14100 punch ! professional home design suite for windows,punch ! software,punch software,69.99,62.99
3525,0,146,2480,microsoft mappoint 2006 standard edition,microsoft b21-00806 ae mappoint 2006 cd,microsoft,,299.0,50.39
3526,0,316,2824,f-secure internet security 2007 3 pcs,panda internet security 2007 panda software,global-marketing-partners,,79.99,49.99
3527,0,624,2762,timbuktu remote control softwre 2 licenses for windows & mac,now software nuw45e1k now up-to-date & contact for windows,netopia,now software,199.99,114.99
3528,0,593,954,adobe indesign cs3 upgrade [ mac ],adobe dreamweaver cs3 upgrade,adobe,,199.0,205.99
3529,0,208,1738,wasp bar code wasp bar code labeler complete package 3 users std cd -,22002170 adobe acrobat standard v. 8.0 complete package 1 user cd win can,wasp technologies,,,295.25
3530,0,883,324,adobe creative suite cs3 production premium,adobe cs3 web premium,adobe,,1699.0,1659.99
3531,0,93,2877,microsoft office frontpage 2003 academic version windows ),microsoft office outlook 2007,microsoft,,159.98,109.95
3532,0,888,286,microsoft oem 3pk xp home edition sp2 n09-01624 ),microsoft windows xp home edition sp2 retail box,microsoft corporation,,,199.99
3533,0,636,1093,mavis beacon teaches typing deluxe v17,mavis beacon ( r ) teaches typing v. 17 deluxe,encore software,,39.99,37.99
3534,0,264,984,adobe photoshop cs3 extended [ mac ],adobe indesign cs3 for mac academic,adobe,,999.0,192.99
3535,0,516,242,adobe creative suite cs3 design premium upgrade [ mac ],adobe cs3 design standard academic,adobe,,599.0,385.99
3536,0,1179,330,microspot x-rip ( mac ),microspot macdraft pe personal edition,microspot ltd,,349.99,85.99
3537,0,950,806,apple logic pro 7.2 upgrade,apple software t9163ll/a logic pro 6,apple,apple software,299.0,809.0
3538,0,689,2095,family tree maker version 16 collectors edition,encore software 10861 family tree maker version 16 collectors edition sb cs,encore software,,,81.97
3539,0,1176,1933,valuesoft tune transfer for ipod software for windows xp,splashid windows mobile software for pocket pc,valuesoft,,29.95,29.95
3540,0,118,1447,crystal reports xi professional edition,i copydvds 2 professional edition,business objects,me-too-software,495.0,27.9
3541,0,1246,1326,peachtree by sage complete accounting 2007,peachtree ( r ) compatible continuous checks-accounting for windows versions 3.5-7 .0,sage software,,269.99,91.59
3542,1,455,2564,brainfood games cranium collection 2006,encore software 11253 brain food games : cranium collection 2006 sb cs by encore,encore software,,19.99,17.97
3543,0,517,1151,adobe photoshop cs3 [ mac ],adobe photoshop cs3 extended complete package 1 user academic cd windows,adobe,,649.0,279.0
3544,0,265,893,adobe indesign cs3 [ mac ],adobe cs3 design premium upgrade,adobe,,699.0,619.99
3545,0,309,3207,family tree maker version 16 deluxe,family tree maker 16 collectors edition,encore,,69.95,99.99
3546,0,195,198,world of warcraft,vivendi blizzard world of warcraft,blizzard entertainment,,19.99,24.99
3547,0,1016,2060,math success deluxe 2007,elementary school success deluxe 2006,topics entertainment,,39.99,15.9
3548,0,799,1958,hp dss software v. 4.0 complete package t1936aa ua0 ),m009a-l00-4 .0 scansoft pdf create ! v. 4.0 complete package 1 user cd win engli,hewlett-packard - ( consumables ),,630.36,43.21
3549,1,1302,745,scrabble with bonus clue,encore software 11610 scrabble with bonus clue win 98 me 2000 xp,encore,,19.99,18.97
3550,0,820,2073,riverdeep adventure workshop 4th-6th grade 8th edition,encore software 12421 adventure workshop 8 1st-3rd,riverdeep,,,17.97
3551,1,1126,941,totally spies : total swamp romp ( pc & mac ),totally spies total swamp romp by brighter minds,brighter-minds-media-inc .,brighter-minds-media-inc .,19.99,19.99
3552,1,1353,621,instant immersion italian deluxe v2 .0 ( large box ),topics entertainment instant immersion italian deluxe 2.0 ( mass merchant box ),topics entertainment,,29.99,31.06
3553,0,27,2123,i copy dvds 2 professional edition,i copy dvds 2 ultra edition,me-too-software,,69.99,29.9
3554,0,248,2419,microsoft windows small business server cal 2003 license pack 20 client addpack device,windows vista business sp microsoft 66j-00063,microsoft software,,,272.38
3555,0,642,372,adobe flash pro cs3 [ mac ],adobe premiere pro cs3 upgrade,adobe,,699.0,308.99
3556,0,1290,1040,punch ! home design architectural series 4000 v10,punch software 35100 punch ! home design suite professional complete product architectural standard 1 user ( s ) complete product pc,punch ! software,,199.99,59.97
3557,0,382,1060,adobe production studio premium,sony media software sound forge audio studio 8 software music production software,adobe,sony-pictures-digital-entertainment,1699.0,69.95
3558,0,1170,3167,steinberg cubase 4 digital audio software,software,steinberg,,999.99,46.99
3559,0,490,2497,microsoft visual studio professional 2005 upgrade,office pro 2007 upgrade microsoft 269-10294,microsoft software,,549.0,257.71
3560,0,738,385,print shop 22 deluxe,cosmi print perfect clip art deluxe,encore,,49.99,6.99
3561,0,1275,2936,punch ! super home suite,punch software 17100 punch ! super home suite,punch ! software,punch software,49.99,45.99
3562,1,869,2287,upgrade crystal reports 11 pro french,upg crystal reports 11 pro french,business objects,,479.78,264.99
3563,0,513,2131,mavis beacon typing 17 ( win/mac ),mavis beacon 16,encore software,,19.99,17.9
3564,0,587,1129,microsoft word 2007 version upgrade,microsoft academic microsoft visio 2003 professional,microsoft,,109.95,159.0
3565,0,678,3021,instant immersion german v2 .0 ( pc & mac ),instant immers spanish dlux 2,topics entertainment,,29.99,36.11
3566,0,1269,2008,punch 5 in 1 home design,instant home design 3.0,punch ! software,,39.99,15.9
3567,0,284,891,sibelius 5 educational edition,microspot macdraft professional edition,sibelius-software-ltd .,,329.0,249.99
3568,0,465,426,adobe creative suite cs3 web standard upgrade [ mac ],adobe cs3 production premium upgrade,adobe,,399.0,822.99
3569,0,1183,147,sims 2 pets expansion pack,sims 2 season expansion pack,aspyr media,,34.99,37.99
3570,0,617,3168,norton antivirus mac 10.0 ( mac ),norton antivirus 2004,symantec,,69.95,49.99
3571,0,114,1402,quickbooks pos : pro multistore 6.0,quickbooks ( r ),intuit inc.,,1399.95,103.99
3572,0,839,361,adobe photoshop cs3 extended,adobe photoshop lightroom,adobe,,999.0,264.99
3573,0,528,1402,quickbooks simple start 2007,quickbooks ( r ),intuit,,99.95,103.99
3574,0,606,2821,microsoft office 2004 professional ( mac ),microsoft excel 2007 ( pc ),microsoft,,499.99,229.95
3575,0,35,1821,the print shop pro publisher 22 deluxe [ dvd ],10731 the print shop 22 pro publisher deluxe complete package 1 user win,encore,,99.99,84.13
3576,0,923,151,adobe illustrator cs3 upgrade [ mac ],adobe indesign cs3 for mac upgrade,adobe,,199.0,205.99
3577,0,504,430,adobe audition 2.0 upgrade,adobe cs3 web standard upgrade,adobe,,129.0,413.99
3578,0,514,375,microsoft windows vista ultimate upgrade [ dvd ],microsoft windows xp home edition sp2 oem,microsoft,,259.95,95.99
3579,0,1215,94,microsoft digital image suite 2006 plus pinnacle studio 10.0,210100533 pinnacle studio plus titanium edition v. 10.5 complete package 1 user,microsoft,,99.95,67.47
3580,0,1032,158,finale allegro 2007,emedia finale allegro,finale,,199.95,169.99
3581,0,773,2867,microsoft office mac 2004 english 3pk dsp 731-01163 ),microsoft onenote 2007 ( pc ),microsoft corporation,,,99.95
3582,1,88,1612,total training for adobe creative suite 3 : design premium bundle,total training for adobe creative suite 3 design premium,total training,,299.99,279.95
3583,0,256,1101,hallmark card studio 2005 deluxe,hallmark card studio 2004,sierra home,,49.99,29.97
3584,0,1262,2839,adobe flash pro cs3 upgrade [ mac ],adobe flash cs3 professional ( mac ),adobe,,199.0,699.0
3585,0,1105,2061,punch ! master landscape & home design,encore software 13931 3d home architect landscape design deluxe version 9,punch ! software,,59.99,25.97
3586,0,518,2206,microsoft office 2004 standard upgrade ( mac ),microsoft office 2004 software suite oem mac apple & mac software,microsoft,,239.99,239.95
3587,0,738,1441,print shop 22 deluxe,print shop deluxe 21,encore,,49.99,44.9
3588,0,996,1604,time money & fractions grades 1-2,time money & fractions grades 1-2 workbook & cd-rom,school zone,,9.99,12.99
3589,1,818,2683,canopus 77010158100 let 's edit,canopus let 's edit video editing software win consumer video editing software,canopus,,99.0,99.95
3590,0,1180,2274,bias peak le 5,bias peak pro 5 software music production software,bias,,129.0,499.0
3591,0,15,1332,omnioutliner professional 3.0,individual software prm-r12 resumemaker professional 12.0,csdc,individual software,69.95,29.99
3592,0,1244,1312,peachtree by sage pro accounting 2007,peachtree ( r ) compatible continuous forms-accounting for windows 8.0-2004 version,sage software,,169.99,241.99
3593,0,648,1484,internet security barrier x4 antispam edition,oem internet security suite 2007 3-user single pack,intego inc,,,32.85
3594,0,30,984,adobe fireworks cs3 [ mac ],adobe indesign cs3 for mac academic,adobe,,299.0,192.99
3595,0,1078,2707,3d home architect home v. 8 by encore software,essential software architecture,encore software,,39.99,53.41
3596,0,1284,1427,punch ! master landscape & home design,punch software 85100 punch!master landscape pro v10 and home design,punch ! software,,99.99,59.97
3597,0,517,151,adobe photoshop cs3 [ mac ],adobe indesign cs3 for mac upgrade,adobe,,649.0,205.99
3598,0,773,2411,microsoft office mac 2004 english 3pk dsp 731-01163 ),office mac 2004 microsoft 731-01002,microsoft corporation,,,331.77
3599,0,508,367,acrobat professional 8 mac upsell standard-professional,adobe acrobat v8 .0 professional for mac upgrade,adobe,,273.0,145.99
3600,0,412,1678,adobe creative suite cs3 web premium upsell [ mac ],adobe creative suite ( v3 .0 ) design premium mac adobe 19500009,adobe,,1399.0,1482.0
3601,0,518,368,microsoft office 2004 standard upgrade ( mac ),adobe cs3 design standard upgrade windows,microsoft,,239.99,413.99
3602,0,866,1447,system care professional,i copydvds 2 professional edition,avanquest,me-too-software,49.95,27.9
3603,1,918,2558,recam remote monitoring software,mobi-cam 70008 monitoring and notification software,mobi-technologies-inc .,mobi-technologies-inc .,129.0,89.69
3604,0,137,81,netmanage rumba unix-hp edition v. 7.3 upgrade license 902453-006 ),910584-001 rumba as/400 edition v. 7.2 upgrade package 1 processor tier p60 c,netmanage,,,26759.24
3605,0,224,129,netmanage rumba web as/400 edition 910584-001 ),910523-002 rumba as/400 edition v. 7.2 upgrade package 1 processor tier p50 c,netmanage,,,20069.43
3606,0,1101,2392,steinberg cubase studio 4,steinberg cubase 4 software educational discount music production software,steinberg,,499.99,349.95
3607,0,930,566,adobe contribute cs3 [ mac ],adobe cs3 web standard,adobe,,149.0,1035.99
3608,0,412,254,adobe creative suite cs3 web premium upsell [ mac ],adobe cs3 web standard upsell,adobe,,1399.0,819.99
3609,0,395,3108,world history ( win/mac ) ( jewel case ),total 3d home deluxe ( jewel case ) ( jce-th6 ),fogware publishing,,9.99,9.59
3610,1,1187,565,clickart 1.2 million 2006 dvd,encore inc clickart 1.2 million 2006 dvd,encore software,,,42.27
3611,0,140,345,retrospect 6.0 desktop mac upgrade,emc insignia retrospect desktop 6.x,dantz,,59.99,89.99
3612,0,40,1157,the print shop 22 deluxe,the print shop ( r ) 22,encore,,49.99,29.99
3613,0,1177,2165,microsoft office student and teacher edition 2004 macintosh,microsoft microsoft office pro 2004 software suite mac apple & mac software,microsoft,,149.99,498.95
3614,0,1324,2638,printmaster platinum v 17.0,printmaster gold v 17.0 ( win 98 me 2000 xp ),encore software,,39.99,19.95
3615,0,788,1118,hoyle puzzle & board games,hoyle ( r ) card games 2007,encore software,,19.95,19.99
3616,0,729,2860,doom 3 ( dvd ) ( mac ),adobe illustrator cs3 ( mac ),aspyr media,,39.99,599.0
3617,0,897,1017,adobe creative suite cs3 production premium upsell,adobe creative suite 3 ( cs3 ) web standard 3 windows upsell from dreamweaver or flash,adobe,,1199.0,799.0
3618,0,632,2616,microsoft windows xp professional full version with sp2,avid xpress pro video editing software for mac and windows professional editing software,microsoft,,299.99,1449.0
3619,0,369,1837,tlc arthur 's kindergarten learning system 2008,encore tlc dr seuss reading learning system 2008,encore,,19.99,17.9
3620,0,779,2926,3d home architect landscape v. 8 by encore software,punch software 41100 punch ! home design architectural series 18,encore software,punch software,39.99,118.99
3621,0,947,3157,britannica deluxe,business planmaker deluxe,avanquest software,,29.95,49.99
3622,0,150,1950,suretrak project manager 3.0,1-57408-058-x suretrak project manager v. 3.0 complete package 1 user cd win,primavera systems,,499.0,436.71
3623,0,859,2933,onone software intellihance pro 4.1,onone software inc. gfs-50211 genuine fractals 5 full 1u,onone software,,,148.97
3624,0,606,3091,microsoft office 2004 professional ( mac ),microsoft ( r ) word 2007,microsoft,,499.99,109.99
3625,0,858,2867,microsoft onenote 2007 upgrade,microsoft onenote 2007 ( pc ),microsoft,,79.95,99.95
3626,0,574,2195,microsoft mappoint 2006 with gps,microsoft microsoft office 2004 software suite mac apple & mac software,microsoft,,349.0,399.95
3627,0,772,485,adobe illustrator cs3 [ mac ],adobe illustrator cs3 upgrade from freehand for mac,adobe,,599.0,206.99
3628,0,322,921,adobe premiere pro 2.0,adobe cs3 production premium,adobe,,849.0,1749.99
